{
  "projection_version": "interface.v2",
  "session_id": "11111111-1111-4111-8111-111111111111",
  "range": { "before_seq": "10", "after_seq": "20" },
  "status": "ready",
  "inventory": {
    "scope": "observed",
    "baseline_completed_seq": "10",
    "unknown_scopes": [],
    "unknown_scopes_complete": true,
    "policy_exclusions": ["store-directory", ".git", "symlinks"]
  },
  "analysis": { "shared_types": "notAnalyzed", "effects": "notAnalyzed", "behavior": "notAnalyzed" },
  "gaps": [], "gaps_complete": true,
  "files": [
    {
      "path": "src/f.ts",
      "before": {
        "kind": "recorded", "record_seq": "4", "field": "snapshot",
        "snapshot": { "kind": "content", "sha256": "e3b0c44298fc1c149afbf4c8996fb92427ae41e4649b934ca495991b7852b855", "size": 0 }
      },
      "after": {
        "kind": "recorded", "record_seq": "20", "field": "after", "observation": "watcher",
        "snapshot": { "kind": "content", "sha256": "bc98078357a5987f2db56aff88ddd897840c5be61e22aac2c7b90843580cc00c", "size": 22 }
      },
      "language": "typescript",
      "language_version": "typescript.v2",
      "status": "ready",
      "coverage": { "before": { "state": "complete" }, "after": { "state": "complete" } },
      "changes": [
        {
          "kind": "added",
          "identity": { "kind": "function", "scope": [], "name": "f", "guards": [] },
          "before": null,
          "after": { "display_name": "f", "span": { "byte_start": 0, "byte_end": 21 } },
          "parameters": [],
          "result": {
            "op": "added",
            "before": null,
            "after": { "kind": "return", "type": { "state": "written", "text": "void" } }
          },
          "throws": { "op": "added", "before": null, "after": { "mode": "notExpressible" } },
          "header": {
            "op": "added",
            "before": null,
            "after": { "modifiers": [], "generic_parameters": [], "constraints": [] }
          }
        }
      ]
    }
  ],
  "page": { "complete": true, "next_after_path": null }
}
