{
  "projection_version": "interface.v2",
  "session_id": "11111111-1111-4111-8111-111111111111",
  "range": { "before_seq": "10", "after_seq": "20" },
  "status": "partial",
  "inventory": {
    "scope": "observed",
    "baseline_completed_seq": "10",
    "unknown_scopes": [],
    "unknown_scopes_complete": true,
    "policy_exclusions": ["store-directory", ".git", "symlinks"]
  },
  "analysis": { "shared_types": "notAnalyzed", "effects": "notAnalyzed", "behavior": "notAnalyzed" },
  "gaps": [],
  "gaps_complete": true,
  "files": [
    {
      "path": "Sources/App/F.swift",
      "before": {
        "kind": "recorded", "record_seq": "4", "field": "snapshot",
        "snapshot": { "kind": "unavailable", "reason": "oversize" }
      },
      "after": {
        "kind": "recorded", "record_seq": "20", "field": "after", "observation": "watcher",
        "snapshot": { "kind": "content", "sha256": "cd347705df7a2a49cedfa9509f7370219d9c3e792d0d7153b50d8be511e3604b", "size": 12 }
      },
      "language": "swift",
      "language_version": "swift.v1",
      "status": "unavailable",
      "fallback_reason": "before-oversize",
      "coverage": { "before": { "state": "unavailable", "reason": "oversize" }, "after": { "state": "complete" } },
      "changes": []
    }
  ],
  "page": { "complete": true, "next_after_path": null }
}
