{
  "projection_version": "interface.v2",
  "session_id": "11111111-1111-4111-8111-111111111111",
  "range": { "before_seq": "3", "after_seq": "4" },
  "status": "ready",
  "inventory": {
    "scope": "observed",
    "baseline_completed_seq": "3",
    "unknown_scopes": [],
    "unknown_scopes_complete": true,
    "policy_exclusions": ["store-directory", ".git", "symlinks"]
  },
  "analysis": { "shared_types": "notAnalyzed", "effects": "notAnalyzed", "behavior": "notAnalyzed" },
  "gaps": [], "gaps_complete": true,
  "files": [
    {
      "path": "src/f.ts",
      "before": {
        "kind": "recorded", "record_seq": "2", "field": "snapshot",
        "snapshot": { "kind": "content", "sha256": "6fd49c9632294277f81b7f8e5238a9deb3ca2403f402603cc69b3dce36c48e5d", "size": 27 }
      },
      "after": {
        "kind": "recorded", "record_seq": "4", "field": "after", "observation": "watcher",
        "snapshot": { "kind": "content", "sha256": "73735729fd3939dbbd09ad864d1929d5b0312b380d45c1a538000e1c3e2cddb4", "size": 29 }
      },
      "language": "typescript",
      "language_version": "typescript.v2",
      "status": "ready",
      "coverage": { "before": { "state": "complete" }, "after": { "state": "complete" } },
      "changes": []
    }
  ],
  "page": { "complete": true, "next_after_path": null }
}
