{
  "projection_version": "interface.v2",
  "session_id": "11111111-1111-4111-8111-111111111111",
  "range": { "before_seq": "3", "after_seq": "4" },
  "status": "ready",
  "inventory": {
    "scope": "observed",
    "baseline_completed_seq": "3",
    "unknown_scopes": [],
    "unknown_scopes_complete": true,
    "policy_exclusions": ["store-directory", ".git", "symlinks"]
  },
  "analysis": { "shared_types": "notAnalyzed", "effects": "notAnalyzed", "behavior": "notAnalyzed" },
  "gaps": [],
  "gaps_complete": true,
  "files": [
    {
      "path": "Sources/App/F.swift",
      "before": {
        "kind": "recorded", "record_seq": "2", "field": "snapshot",
        "snapshot": { "kind": "content", "sha256": "f6ccc2782c3300061da168a9f8396f07d58763d943ec6751f9c7a1c935394e12", "size": 58 }
      },
      "after": {
        "kind": "recorded", "record_seq": "4", "field": "after", "observation": "watcher",
        "snapshot": { "kind": "content", "sha256": "f2748c476ec26e385d9ebfc3f578ca974e7c7eefa0956bc5c6ebb56700d8af8b", "size": 60 }
      },
      "language": "swift",
      "language_version": "swift.v1",
      "status": "ready",
      "coverage": { "before": { "state": "complete" }, "after": { "state": "complete" } },
      "changes": [
        {
          "kind": "signatureChanged",
          "identity": { "kind": "function", "scope": [], "name": "f", "guards": [] },
          "before": { "display_name": "f(_:)", "span": { "byte_start": 0, "byte_end": 57 } },
          "after": { "display_name": "f(_:)", "span": { "byte_start": 0, "byte_end": 59 } },
          "parameters": [
            {
              "op": "equal",
              "before": { "position": 0, "label": "_", "name": "x", "binding": "identifier", "type": { "state": "written", "text": "T" }, "optional": false, "variadic": false, "default": null, "modifiers": [] },
              "after": { "position": 0, "label": "_", "name": "x", "binding": "identifier", "type": { "state": "written", "text": "T" }, "optional": false, "variadic": false, "default": null, "modifiers": [] }
            }
          ],
          "result": {
            "op": "equal",
            "before": { "kind": "return", "type": { "state": "written", "text": "T" } },
            "after": { "kind": "return", "type": { "state": "written", "text": "T" } }
          },
          "throws": { "op": "equal", "before": { "mode": "none" }, "after": { "mode": "none" } },
          "header": {
            "op": "changed",
            "before": { "modifiers": [], "generic_parameters": ["T: Equatable"], "constraints": ["T: Hashable"] },
            "after": { "modifiers": [], "generic_parameters": ["T: Equatable"], "constraints": ["T: Comparable"] }
          }
        }
      ]
    }
  ],
  "page": { "complete": true, "next_after_path": null }
}
