{
  "projection_version": "interface.v2",
  "session_id": "11111111-1111-4111-8111-111111111111",
  "range": {
    "before_seq": "4",
    "after_seq": "5"
  },
  "status": "ready",
  "inventory": {
    "scope": "observed",
    "baseline_completed_seq": "4",
    "unknown_scopes": [],
    "unknown_scopes_complete": true,
    "policy_exclusions": [
      "store-directory",
      ".git",
      "symlinks"
    ]
  },
  "analysis": {
    "shared_types": "notAnalyzed",
    "effects": "notAnalyzed",
    "behavior": "notAnalyzed"
  },
  "gaps": [],
  "gaps_complete": true,
  "files": [],
  "page": {
    "complete": true,
    "next_after_path": null
  }
}
