{
  "projection_version": "interface.v2",
  "session_id": "11111111-1111-4111-8111-111111111111",
  "range": { "before_seq": "3", "after_seq": "5" },
  "status": "ready",
  "inventory": {
    "scope": "observed",
    "baseline_completed_seq": "3",
    "unknown_scopes": [],
    "unknown_scopes_complete": true,
    "policy_exclusions": ["store-directory", ".git", "symlinks"]
  },
  "analysis": { "shared_types": "notAnalyzed", "effects": "notAnalyzed", "behavior": "notAnalyzed" },
  "gaps": [], "gaps_complete": true,
  "files": [
    {
      "path": "src/f.ts",
      "before": { "kind": "recorded", "record_seq": "2", "field": "snapshot",
        "snapshot": { "kind": "content", "sha256": "86e1381da984ad21459e1e796d08963d95ee1ef6eca5987ecf6fa1fef5d64e46", "size": 31 } },
      "after": { "kind": "recorded", "record_seq": "5", "field": "after", "observation": "watcher",
        "snapshot": { "kind": "content", "sha256": "86e1381da984ad21459e1e796d08963d95ee1ef6eca5987ecf6fa1fef5d64e46", "size": 31 } },
      "language": "typescript",
      "language_version": "typescript.v2",
      "status": "identical",
      "coverage": { "before": { "state": "notEvaluated" }, "after": { "state": "notEvaluated" } },
      "changes": []
    }
  ],
  "page": { "complete": true, "next_after_path": null }
}
