{
  "projection_version": "interface.v2",
  "session_id": "11111111-1111-4111-8111-111111111111",
  "range": { "before_seq": "3", "after_seq": "4" },
  "status": "partial",
  "inventory": {
    "scope": "observed",
    "baseline_completed_seq": "3",
    "unknown_scopes": [],
    "unknown_scopes_complete": true,
    "policy_exclusions": ["store-directory", ".git", "symlinks"]
  },
  "analysis": { "shared_types": "notAnalyzed", "effects": "notAnalyzed", "behavior": "notAnalyzed" },
  "gaps": [],
  "gaps_complete": true,
  "files": [
    {
      "path": "Sources/App/F.swift",
      "before": {
        "kind": "recorded", "record_seq": "2", "field": "snapshot",
        "snapshot": { "kind": "content", "sha256": "c8b5c7f8d1396e03d98a7704dcfe46b69f6aae0f9504c5eb838fbcba58cd3ab8", "size": 20 }
      },
      "after": {
        "kind": "recorded", "record_seq": "4", "field": "after", "observation": "watcher",
        "snapshot": { "kind": "content", "sha256": "ca411a3a36f5dfb28a446d7b1491157c0011fdf1483595b90b05b2be5f306e6f", "size": 23 }
      },
      "language": "swift",
      "language_version": "swift.v1",
      "status": "unavailable",
      "fallback_reason": "before-blob-missing",
      "coverage": { "before": { "state": "unavailable", "reason": "blob-missing" }, "after": { "state": "complete" } },
      "changes": []
    }
  ],
  "page": { "complete": true, "next_after_path": null }
}
