{
  "projection_version": "interface.v2",
  "session_id": "11111111-1111-4111-8111-111111111111",
  "range": { "before_seq": "3", "after_seq": "4" },
  "status": "ready",
  "inventory": {
    "scope": "observed",
    "baseline_completed_seq": "3",
    "unknown_scopes": [],
    "unknown_scopes_complete": true,
    "policy_exclusions": ["store-directory", ".git", "symlinks"]
  },
  "analysis": { "shared_types": "notAnalyzed", "effects": "notAnalyzed", "behavior": "notAnalyzed" },
  "gaps": [],
  "gaps_complete": true,
  "files": [
    {
      "path": "src/f.ts",
      "before": {
        "kind": "recorded", "record_seq": "2", "field": "snapshot",
        "snapshot": { "kind": "content", "sha256": "505958da24386f0aec970545c549ce6f9e3a57cbc569a0a46ede6d843ce47967", "size": 33 }
      },
      "after": {
        "kind": "recorded", "record_seq": "4", "field": "after", "observation": "watcher",
        "snapshot": { "kind": "content", "sha256": "ec77aad65b868e8b41ce771379908117a8d2244742480fbf03d6c1ec08b2d779", "size": 36 }
      },
      "language": "typescript",
      "language_version": "typescript.v2",
      "status": "ready",
      "coverage": { "before": { "state": "complete" }, "after": { "state": "complete" } },
      "changes": [
        {
          "kind": "signatureChanged",
          "identity": { "kind": "function", "scope": [], "name": "f", "guards": [] },
          "before": { "display_name": "f", "span": { "byte_start": 0, "byte_end": 32 } },
          "after": { "display_name": "f", "span": { "byte_start": 0, "byte_end": 35 } },
          "parameters": [
            {
              "op": "removed",
              "before": { "position": 0, "label": null, "name": "{ a, b }", "binding": "pattern", "type": { "state": "written", "text": "P" }, "optional": false, "variadic": false, "default": null, "modifiers": [] },
              "after": null
            },
            {
              "op": "added",
              "before": null,
              "after": { "position": 0, "label": null, "name": "{ a, b, c }", "binding": "pattern", "type": { "state": "written", "text": "P" }, "optional": false, "variadic": false, "default": null, "modifiers": [] }
            }
          ],
          "result": {
            "op": "equal",
            "before": { "kind": "return", "type": { "state": "written", "text": "void" } },
            "after": { "kind": "return", "type": { "state": "written", "text": "void" } }
          },
          "throws": { "op": "equal", "before": { "mode": "notExpressible" }, "after": { "mode": "notExpressible" } },
          "header": {
            "op": "equal",
            "before": { "modifiers": [], "generic_parameters": [], "constraints": [] },
            "after": { "modifiers": [], "generic_parameters": [], "constraints": [] }
          }
        }
      ]
    }
  ],
  "page": { "complete": true, "next_after_path": null }
}
