{
  "projection_version": "interface.v2",
  "session_id": "11111111-1111-4111-8111-111111111111",
  "range": { "before_seq": "3", "after_seq": "4" },
  "status": "ready",
  "inventory": {
    "scope": "observed",
    "baseline_completed_seq": "3",
    "unknown_scopes": [],
    "unknown_scopes_complete": true,
    "policy_exclusions": ["store-directory", ".git", "symlinks"]
  },
  "analysis": { "shared_types": "notAnalyzed", "effects": "notAnalyzed", "behavior": "notAnalyzed" },
  "gaps": [],
  "gaps_complete": true,
  "files": [
    {
      "path": "Sources/App/F.swift",
      "before": {
        "kind": "recorded", "record_seq": "2", "field": "snapshot",
        "snapshot": { "kind": "content", "sha256": "4870087e2267837ddcbcd473cc8f9aa6515d4fc6d452950e2f36d3dac9a2bce6", "size": 33 }
      },
      "after": {
        "kind": "recorded", "record_seq": "4", "field": "after", "observation": "watcher",
        "snapshot": { "kind": "content", "sha256": "687960c91515214b543375140973897b30eada601d9718d1b669da04d1287ff5", "size": 39 }
      },
      "language": "swift",
      "language_version": "swift.v1",
      "status": "ready",
      "coverage": { "before": { "state": "complete" }, "after": { "state": "complete" } },
      "changes": [
        {
          "kind": "removed",
          "identity": { "kind": "function", "scope": [], "name": "trace", "guards": ["DEBUG"] },
          "before": { "display_name": "trace()", "span": { "byte_start": 10, "byte_end": 25 } },
          "after": null,
          "parameters": [],
          "result": {
            "op": "removed",
            "before": { "kind": "return", "type": { "state": "implicit", "text": "Void" } },
            "after": null
          },
          "throws": { "op": "removed", "before": { "mode": "none" }, "after": null },
          "header": {
            "op": "removed",
            "before": { "modifiers": [], "generic_parameters": [], "constraints": [] },
            "after": null
          }
        },
        {
          "kind": "added",
          "identity": { "kind": "function", "scope": [], "name": "trace", "guards": ["!(DEBUG)"] },
          "before": null,
          "after": { "display_name": "trace()", "span": { "byte_start": 16, "byte_end": 31 } },
          "parameters": [],
          "result": {
            "op": "added",
            "before": null,
            "after": { "kind": "return", "type": { "state": "implicit", "text": "Void" } }
          },
          "throws": { "op": "added", "before": null, "after": { "mode": "none" } },
          "header": {
            "op": "added",
            "before": null,
            "after": { "modifiers": [], "generic_parameters": [], "constraints": [] }
          }
        }
      ]
    }
  ],
  "page": { "complete": true, "next_after_path": null }
}
