{
  "projection_version": "interface.v2",
  "session_id": "11111111-1111-4111-8111-111111111111",
  "range": {
    "before_seq": "3",
    "after_seq": "4"
  },
  "status": "skipped",
  "fallback_reason": "timeout",
  "inventory": null,
  "analysis": {
    "shared_types": "notAnalyzed",
    "effects": "notAnalyzed",
    "behavior": "notAnalyzed"
  },
  "gaps": null,
  "gaps_complete": false,
  "files": [],
  "page": {
    "complete": false,
    "next_after_path": null
  }
}
