{
  "projection_version": "interface.v2",
  "session_id": "11111111-1111-4111-8111-111111111111",
  "range": { "before_seq": "10", "after_seq": "20" },
  "status": "partial",
  "inventory": {
    "scope": "observed",
    "baseline_completed_seq": "10",
    "unknown_scopes": [],
    "unknown_scopes_complete": true,
    "policy_exclusions": ["store-directory", ".git", "symlinks"]
  },
  "analysis": { "shared_types": "notAnalyzed", "effects": "notAnalyzed", "behavior": "notAnalyzed" },
  "gaps": [], "gaps_complete": true,
  "files": [
    {
      "path": "src/f.py",
      "before": {
        "kind": "recorded", "record_seq": "4", "field": "snapshot",
        "snapshot": { "kind": "content", "sha256": "960771da576dd73ed4ed2b0a1a556e66aa4464d3f2b0348f1a88e2a98ceab95c", "size": 19 }
      },
      "after": {
        "kind": "recorded", "record_seq": "20", "field": "after", "observation": "watcher",
        "snapshot": { "kind": "content", "sha256": "a9a255cc86822586b917ff57839ae31e917c901e6d9a7b64f86fc643214399b4", "size": 22 }
      },
      "language": null,
      "language_version": null,
      "status": "unavailable",
      "fallback_reason": "before-blob-missing",
      "coverage": { "before": { "state": "unavailable", "reason": "blob-missing" }, "after": { "state": "unsupported" } },
      "changes": []
    }
  ],
  "page": { "complete": true, "next_after_path": null }
}
